,Classificacao,Tweet
151,Midia,a fic que a galera montou de que o gustavo do bbb namoraria a lana kkkkkkkkkkkkkkkk eu amei
152,Midia, e a fic da nath grávida permanecerá até o fim do bbb
153,Midia,a melhor fic desse bbb é a natalia grávida
154,Midia,eu tô morrendo com a fic do gustavo do bbb com a lana del rey kkkkkklkkkkklklk
155,Midia,a produção do bbb conseguiu estragar com a prova de resistência nunca mais será a mesma será que a americanas só pagou por de exposição direta da marca a fic 
156,Midia, parei de ler na a favorita desse bbb pq já começou falando fic
157,Midia,uma fanfic sobre um participante do bbb que se apaixona por um dummy
158,Midia,já fiz a fic do meu casamento com esse dummy de 
159,Midia,ainda escreverei uma fanfic envolvendo o dummy baixinho do bbb
160,Midia, essa fic merece um filme na netflix capitulodeprisaosemgrade
161,Midia,a fic da nat grávida é uma das coisas que mais me mata de rir nesse bbb 
162,Midia, próxima fanfic a virar filme da netflix
163,Midia, a fic kkkkkkkk
164,Midia,eu te amo fic da lana del rey com o gustavo do bbb eu te amo
165,Midia,a única coisa boa desse bbb ta sendo a fic ou não que a badnat ta grávida
166,Midia,eu amo essa fanfic da natália do bbb tá grávida todos os memes são perfeitos 
167,Midia,ela só se equivocou no lance dos seguidores pq isso realmente não significa nada mas a fic da globo eu acredito é a mesma coisa que rolou com a cabeçuda tudo que eles precisam é de cast jovem e com fãs cansamos de ver atores perdendo papel por ter poucos seguidores 
168,Midia, tu não tá vendo que isso é fanfic a torcida tá baixando nivel tentando queimar a mulher que não faliu nada disso 
169,Midia,eu amo a fic de que com certeza a lana del rey namoraria o gustavo do bbb
170,Midia,já pensou se a lana vê a fic que o povo tá criando dela com o gustavo conhece ele depois q ele sair do bbb e começa a namorar com ele
171,Midia,a natália saindo do bbb e descobrindo que o povo criou uma fic que ela tava grávida 
172,Midia, eu também não julgo ele não o lewis apareceu bem pouco nas outras temporadas só nessa que tá aparecendo mais mas a netflix é um lixo pq ela cria uma fanfic onde realmente não tem eu tô passando mta coisa dessa temporada bem ruim
173,Midia,juro q to amando a fic de lana e o gustavo do bbb
174,Midia, eu n sabiaa q ele tava na globo mas nossaa bora fanficar agr seria tudo né ai grava o fantastico dps pega mais roupas na casa dela e volta pro rio pra repescagem deus sua filha está prontaaaaa
175,Midia, olha a fic kkkkkkkkkkkkkkkk vai desmaiar é patético
176,Midia,tô imaginando uma fanfic entre lana del rey e gustavo do bbb
177,Midia,minha fic favorita do bbb é a da pregnat kkkkk 
178,Midia,desisti do elenco do bbb na segunda semana mas dou gostosas risadas com a fic da pregnat
179,Midia,essa pausa na superliga tá insuportável é treta com fc é jogadora porno é fic hetero na record 
180,Midia, vou avisar a record q errou mirou não fic de milhões
181,Midia,vou ver a sexta temporada na netflix mantendo a fanfic na minha cabeça de que na verdade elas ficaram juntas no final
182,Midia,rindo mto da fic do tiktok que dizia que a lana del rey namoraria o gustavo do bbb
183,Midia,essa fic aparece em todo bbb lembro que quem criou foi a torcida da gizelly bicalho 
184,Midia,essa é a pior edição do bbb por ser baseada em fake news altas mentiras e sensacionalismo do que acontece lá dentro povo não vê pay per view e cria fan fic
185,Midia, é que mesmo gostando de bbb me parece babaquice virar madrugadas por isso tlg até mesmo criar fic como um cara que tem informações da votação da própria globo me parece babaquice mas se faz a galera feliz e n fere ninguém qual o problema gosto de bbb mas não a esse ponto
186,Midia, toda hora uma notinha paga com um record dela que ninguém liga kkk já tentou até fanficar q bateu recordes de shakira kkkkk
187,Midia, em minha defesa eu digo que eu só tô vendo alguém descobrindo as coisas para o entretendimento já que o bbb flopou estamos nos divertindo na fanfic aqui fora tomara que ele não nos mate kkk
188,Midia,essa fanfic ta mais interessante de acompanhar que as novelas da globo 
189,Midia, vocês é essa fic de q o prior era um bom jogador no bbb
190,Midia, o bbb faturou quase milhões só com a cota de patrocínio e vocês acreditando nessa fic
191,Midia, kkkkkk que bbb paralelo é esse que tu assiste pára de passar vergonha distorcendo tudo e inventando fic
192,Midia,o arthur é tão protagonista que os fãs dele estão atrás da jade mesmo depois dela ter sido eliminada kkkkkkk não tem mais o que comentar do bbb e agora inventam fic pra ter assunto kkkkk descansa 
193,Midia,adoro que o engajamento da barbara ta forte pos bbb me lembra a kerline só que do mal a fic vai ser ótima 
194,Midia,não tem mais o que comentar do bbb e agora inventam fic pra ter assunto vão ganhar é processo falando coisa que não sabem dos outros aí achando que internet é terra de ninguém mas só poderia ser fã de quem né só exemplos bons dele e a própria mulher 
195,Midia,não mais falando sério aqui pra quem gosta de fic de pós do bbb essa é perfeita que att perfeita de hoje 
196,Midia, kkkkkkkkk não tem mais o que comentar do bbb e agora inventam fic pra ter assunto descansa
197,Midia, um filme da netflix baseada numa fanfic do wattpad horrível
198,Midia,não mas fanfic que criaram da lana del rey com o gustavo do bbb
199,Midia, enquanto isso a netflix faz de fanfic bosta
200,Midia, fic tadinha só procurar promo na internet sempre tem na amazon principalmente o ultimo paguei 
201,Midia, fanfic vocês são demais kkk vocês criam um mundo paralelo onde só a opinião de vocês é a certa não se esforça nem pra entender kkk
202,Midia,rodrigo é o maior lunatico fanfiqueiro coca cola desse bbb não queria esse ser de volta não
203,Midia,a galera tá tão carente de um enredo bom de bbb que estão resgatando momentos de manu e prior e fazendo vídeos tipo fanfic dos dois juntos e uma galera shippando kkkkkkkkkkk tô passando mal
204,Midia,a fic que o scooby nunca tinha assistido bbb caindo por terra por ele mesmo 
205,Midia, o rosto dos emos mudando a cada imagem nem a globo seria capaz de criar uma fanfic dessas
206,Midia,que ódio que o pessoal do bbb não caiu na fic da jade kkkkkk
207,Midia,gente assistam “o caso rachel dolezal” na netflix a maior fanfiqueira da história a bicha criou uma história e acreditou mesmo
208,Midia, o boninho não seria tão inteligente de fazer algo tão extraordinário assim ele ta básico só ta fazendo coisa manjada já por isso o bbb ta tão ruim épico seria a jade voltando de dummy hoje e o público sendo trollado mas não vou alimentar minha fic
209,Midia,as mina do tik de anos fazendo fic do gustavo de bbb e da lana del rey kakakakkaakkaka
210,Midia, não vejo bbb mas leria essa fic é votaria nos meus piticos até o fim pobrete campeão 
211,Midia,amanhã tem drive to survive ansiosa pra nova fic q a netflix criou na temporada passada
212,Midia, a comercialização reduziu a nada o impacto estético e filosófico da criação não pode fazer fanfic de lotr porque o direito ão da amazon 
213,Midia, a parada começa aqui e termina no ig no comentarista do youtube na sônia abrão nos pod cast de bbb e por aí vai aqui no twitter surge os vídeos pra desmarcar a mentira mas nas páginas de fofoca não tem que matar aqui as fic pq saiu daqui o bagulho cresce d e o povo cai 
214,Midia,eu n tenho mais amigas pra comentar sobre a taylor ai to fanficando aqui em contar pra juliette e assistir o doc na netflix juntas 
215,Midia, booktrailer loucamente apaixonados autora lyne m 
216,Midia,criei uma fic que o gustavo vai ganhar o bbb e vai se apaixonar por mim numa viagem que farei pro sul só falta publicar no wattpad
217,Midia,o tanto de fic q a gaga inventaria se chamassem ela p um filme biografico n ta escrito na biblia 
218,Midia,a melhor fic desse bbb até agora 
219,Midia, e pelo tamanho do bando dele eles se organizavam e colocavam todo mundo no paredão kkkkkkkkkk e eu aqui fanficando um bbb hehehe no mundo ideal teríamos essa certa pessoa como primeiro eliminado
220,Midia, o bbb da fanfic do gil o povo é mais interessante gilzinho é muito emocionado 
221,Midia,a fanfic do na ana maria sobre o bbb kkkkkkkkkkkkkkkkkkk 
222,Midia, infelizmente nem a favorita e nem vale tudo vão vir é sonho e fanfic do pessoal a globo é muito óbvia e vai ficar entre mulheres apaixonadas ou amor a vida 
223,Midia, a solução é parar de ficar shipando e fanficando todo mundo a própria confusão já presume que alguém tá tentando tirar conclusões do que não sabe e do que não tem nada a ver com ela mas a gente tá falando de bbb q só existe pq pessoas gostam de cuidar da vida alheia
224,Midia, nunca assistiu as pessoas que vem crítica você e a laís são pessoas que não assitir bbb pq não tem como concorda e muita fanfic com o nome de vocês 
225,Midia, desse tipo é sim kkkkkkk eles criam essa fic desde a saída estão nessa vibe 
226,Midia, já ta na hora das pessoas entenderem que o bbb mexe com a cabeça das pessoas e obviamente tira o pior delas la dentro isso n pode refletir a vida aqui fora alias esse negocio da globo construir img é pura fic 
227,Midia,hahahahaha amando a fic que ele saiu do bbb pra ver musicais 
228,Midia,essa novela da globo tá superando fanfic tá superando até série da netflix muito boa atuação pqp
229,Midia, arthur criando fic pra manter enredo a maira deve ter dado um vai curso de bbb pra ele hahahhaahhahahahhahahahah o cara tá abandonando o único que se dispôs a jogar cm ele hahahahahahahaah
230,Midia,desde o início é assim e vai ser assim até o final do programa se bobear o bbb vai acabar e vai ter torcida inventando fic ainda 
231,Midia,outra fic é me imaginar famosa por algum motivo seja sendo ex bbb ou pq sou apresentadora do globo repórter
232,Midia,bbb acabou ontem pra mim minha campeão saiu n vou ver mais nada e pensar que ela que ganhou fanfic vibes ahhaha o bbb hahahhahaha
233,Midia,eu n vou nem ver essa festa do bbb hoje q eu tou c saudade de fanficar eles me julguem 
234,Midia, e fanficar d imagina o boninho jogando ela lá dentro hahahaaha esse bbb ia bater uma pontos de audiência hahahahaha
235,Midia, o cara mede os outros pela régua dele não sabe da história toda é já sai criando fanfic 
236,Midia,amo ver a fic do pessoal no bbb fazendo a biometria no picpay c biquinho língua etc lkkkkkk jurou
237,Midia,a fic de que a record tomou prejuízo de milhões quando a raissinha foi eliminada se repetindo akskskskkskskk 
238,Midia, a lady gaga montando a fic ja de como desceu o espirito santo nela antes de gravar o live action da biblia
239,Midia,fic de centavos kkkkkkkkkkkkkkk pior que autor de novela da record
240,Midia,essa novela piora a cada dia espero que a licia manzo nunca mais pise na globo mulher maluca até uma fic do wattpad tem mais coerência
241,Midia,a mulher surtando com a roupa da própria que iria usar no bbb mas saiu antes tiram as fic do cu 
242,Midia,o picpay só funciona no bbb mesmo é uma fanfic
243,Midia,como assim tem fanfic que se passa em petropolis sem ser novela de imperador na globo e eu não sabia
244,Midia,eu chamei minha irmã pelo whats app da minha empresa e convidei ela pra uma entrevista de emprego… até aí tudo bem quando fui falar da vaga eu tava oferecendo pra ela uma vaga de dummie no bbb e ela nem tinha sacado que era uma fic coitada 
245,Midia, jahejehekwkwwk pior que eu também achei fanfic viny após sua participação no bbb ao sair se encontra com o cantor kanye west por quem ficou completamente apaixonado esquecendo o eliezer os dois se encontram se apaixonaram e criaram uma família viny engravida e kanie 
246,Midia,angelo é simplesmente a pessoa que mais cai em fic do bbb ele acabou de chegar pra mim e falar amor tu viu o que viny fez e me mostrar uma montagem do menino careca
247,Midia, na fic da minha cabeça no pior cenário natália acaba ficando com o gustavo depois que a laís sair e fazem campanha pro bozo com força em outubro a sensação que tenho é que tanto arthur natália e até o dg são os anti juliette em esteroides meu medo real é outubro não o bbb 
248,Midia, e foi assim que descobrimos que a bíblia é uma fanfic
249,Midia,pra que ela postou esse roteiro isso não fez o menor sentido até pra ela kkkkk triste fim de uma linda fic insira aqui o vídeo da eliminação da patrícia no bbb 
250,Midia,pa viveu uma fanfic a jade era crush dele vão para a mesma edição do bbb e eles ficam
251,Midia, a é da mesma altura da tô pensando numa fic aqui kkkkkkkkk
252,Midia,e aí nisso o dummy sai correndo o pessoal sai correndo atrás jurando que é a jade eles conseguem desmascarar o dummy a gente descobre a identidade dele vê que é um ator da record falido kkkkkkkkk minha fic tá pronta
253,Midia, na tua fic né ninguém quer saber quem será o prior mas quem será a nova juliette no os participantes vivem falando dela lá dentro e os tuiteiros aqui fora tudo se referem a ela tem tuiteiro implorando por uma migalha de comentário dela sobre bbb 
254,Midia,juliette é uma pessoa real com uma história real dentro e fora do bbb arthur é só um escroto que traiu a mulher e agora fica se fazendo de bom moço pra limpar a imagem e cria fanfic que é perseguido na casa they are not the same 
255,Midia,netflix mia fia agiliza isso aí precisamos de max petterson na série o amigo brasileiro da emily a fic já tá pronta 
256,Midia,não pode fanfic de fã na internet pode fanfic da amazon prime 
257,Midia, o vyni é o maior fanfiqueiro da história de todos os bbb’s kkkkkkkkkkkk
258,Midia, os fatos da tua fic 
259,Midia, a globo sendo fanfiqueira desde sempre 
260,Midia, arthur só foi pro bbb pra tirar a reputação dele de ter saído com garotas de programa enquanto estava casado uma pena as pessoas acreditarem nessa fic
261,Midia,serio eu faço minha própria fanfic pra eu sofrer sem motivo netflix não me ouve não pelo amor de deus 
262,Midia, ñ foi criança esperança ñ no dia do ce a fic delas é q ele passou o niver dele com ela foi na gravação de algum outro programa da globo mas ñ importa tb o q importa é q uma vez elas comprovam q nosso ranço por elas tem tds os motivos do universo pra existir
263,Midia,eu sei que isso não é fic pois na hora estava geral comentando que a natália estava sendo machista e usando a bíblia que natnaro tinha voltado e etc 
264,Midia,essa msc e meu despertador ja acordo fanficando com uma pessoa específica to apaixonada ai 
265,Midia,essa msc e meu despertador ja acordo fanficando com uma pessoa específica to apaixonada ai 
266,Midia, comentarista do bbb e criador fanfic
267,Midia,gente a galera do bbb ta vivendo muito forte a fic da jade em paredão falso kkkkk amo a queda vai ser hilaria
268,Midia,parei com a bíblia e vou ler fanfic kkkk bjs
269,Midia, a fic do pessoal não tem mais ela dentro do bbb e arranja motivo pra falar mal aqui fora tb 
270,Midia,enquanto isso a amazon fazendo uma fanfic milionária cheia de coisas fonte vozes da minha cabeça e eles deixando k k 
271,Midia,eu ganharia o bbb fácil fácil super fanfiqueira minto que nem sinto quer arthur melhor que eu mais dissimulada q eu o preconceito eu engulo com pão 
272,Midia,já se perdeu essa aq primeiro que o gustavo ja falou pra lais que a eslo ta cancelada segundo que até a própria larissa falou tbm desmentiu a própria fic terceiro cuidado pra não cair do cavalo em fãs do arthur vcs tão no topo hj amanhã vcs tão na merda bbb muda td 
273,Midia, tua fic é melhor q o bbb todinho
274,Midia, alguém por favor invista numa fic kkkk
275,Midia, avisei que ela não entrou para jogar mas sim para criar uma fanfic dela mesma a vilã linda e popular que namora o mais gato e popular do rolê com amigos badalados e seus súditos que fazem suas vontades e um rival direto para infernizar é sobre isso 
276,Midia,meteram essa depois vender os direitos de adaptação dos apêndices de o senhor dos anéis para a amazon literalmente fazer fan fic 
277,Midia,acho graça da aquela fic que os bolsominions acreditam de que a globo tá falindo
278,Midia, isso me cheira a amazon batendo o pé e pedindo que a única fanfic que vale é a deles
279,Midia, serio vc acha mesmo que se a globo fosse manipular ela não tiraria primeiro as plantas a globo entrou tbm em todas as enquetes de todas as redes sociais porque em todas a jade tbm saia isso é uma fic pior ainda 
280,Midia,juro ela cita séries da netflix a cada segundos é toda fanfiqueira e fofoqueira sofreu pressão pelo corpo no passado aff sou eu toda 
281,Midia,não se pode proibir a fanfic a instituição mais forte na literatura desde que dante escreveu a divina comédia a famosa fanfic da bíblia 
282,Midia,meu pai perguntando se a mulher do bbb que tá grávida já saiu kkkkkkkkkkkkkkkkk a fic da pregnat
283,Midia,a gay é mais fanfiqueira que eu minhas personalidade juntas 
284,Midia,na fanfic da minha cabeça na verdade o arthur desenvolveu um super crush nela pq ela odiava ele e ele gosta de apanhar de mulher 
285,Midia, eles tbm ficaram nessa fic qnd o rodrigo saiu kkkkkkkk
286,Midia,essa larissa do bbb é doida né completamente maluca cria umas fanfic aí quando tu vai ver o signo da mona gêmeos porra será que eu sou assim 
287,Midia, da vida dela da fanfic dela da saída do bbb dela com certeza dessas coisas ela foi e é protagonista 
288,Midia,a cada vez que acordo a fic que o arthur e a jade tiveram algo fora do bbb está mais forte e nutrida
289,Midia, foi uma brincadeira apenas mas vocês usam esse único argumento pra alimentar uma coisa que não existe novamente eu reforço você pode criar a fic que você quiser mas toda história da jade dentro do bbb mostra que ela nunca teve interesse amoroso no arthur a própria afirmou
290,Midia, ué se tá proibido fanfic então como fica a nova série da amazon prime kkkkkkkk
291,Midia,vamos de isso ou aquilo comentem disney x terror desenho x gibi livro x fanfic netflix x amazon spotify x deezer filme x novela dublado x legendado marvel x dc dêem rt e usem a tag gabimartins no encontro
292,Midia,até hoje essa fic que a comidinhas da terra não foi uma chata metralhadora de merda no bbb
293,Midia,vocês tiraram minha fic do bbb agora vou voltar a ler hahahahahahah
294,Midia,sabe aquela larissa do bbb a que criava fanfic pois bem conheci uma pessoa igual a ela no caso essa pessoa sonha com as coisas acredita que é real o sonho e vem puxar briga 
295,Midia,imagina levar bbb pro pessoal é tipo fic que o é o messi se odeiam 
296,Midia,amo que a própria jade matou essa fic no rede bbb falando que acha que ngm ta fazendo personagem lá pq não tem como dps de semanas 
297,Midia,netflix que tipo de fanfic é essa 
298,Midia, os fãs que nem conseguiram deixar ela estão dando prejuízo a globo hahahah fic de centavos
299,Midia, nunca existiu lá dentro foi só uma fanfic criada aqui fora que durou muito pouco a única rivalidade que teve lá dentro foi o artur e fiuk e não foi nada para entrar para história do bbb 
300,Midia,agr o bbb realmente não vai ter mais nada de interessante pq essa rivalidade sendo fanfic da cabeça da jade ou não movimentou o jogo agr vai ser só uma colônia de férias
301,Midia,não acredito que país está se deixar levar por uma fanfiqueira que pôs o marido adúltero no bbb 
302,Midia, a gay mais fanfiqueira que nós duas juntas
303,Midia, é fic sua velha burra aposto que acompanha bbb pelo instagram kkkkkkkkk
304,Midia,a fanfic da jade no bbb ja acabou triste fim pra vida das patricinhas hj e sempre bom dia so pra quem nao perdeu tempo votando e mesmo assim sabia q a sairia 
305,Midia, da manhã e eu indo pesquisar a idade de léo picon no google pra ver se dá pra fanficar um romance entre eu e ele depois de vê lo nos vídeos da rede bbb e achar gato kkkkkk
306,Midia,o maior mico desse bbb ta sendo as pessoas q estão comprando a fic desse arthur
307,Midia, então a galera ta criando maior fanfic em cima disso é muita falta de ter o que comentar o bbb tá tão flopado que a galera precisa usar a própria imaginação
308,Midia,se a produção for inteligente vai aproveitar essa fic de paredão falso e dar uma tolada daquelas ahh esqueci que é bbb sem chance 
309,Midia, por isso q eu disse q é uma fic natália deveria real ter acompanhamento psicólogo psiquiátrico pq aquilo é carência pura ela fala q está cansada de ser aquela mulher negra gostosa q dança e tem um corpão mas ela age de maneira errada não é em bbb q ela irá ser amada
310,Midia, eu não gosto de chipar pessoas é cafona e às vezes sem noção eu sei mas caí na fic de natália com gustavo sinto vergonha de chipar pessoas mas o q posso fazer daria um bom casal e olha q acho uma chatice ver casais em bbb mas né não é culpa minha
311,Midia, nossa deveria ter vc queria uma resposta para uma rivalidade que você criou o brasil deu a resposta e você nao quis aceitar hoje o brasil te dá a resposta que você não merece uma segunda chance no bbb eu queria mtt essa referência da resposta e rivalidade fic da cabeça dela
312,Midia,ele vai se mudar pra são paulo depois que ganhar o bbb vão conversar sobre a relação vão continuar ficando e o namoro vem 
313,Midia, parece que ela é meio apaixonadinha no arthur parece amor não correspondido só falava nele hrs ficou chateada com ele e começou a criar fic de rivalidade por ele não ter dado apenas um parabéns quando ela ganhou uma prova forçada demais 
314,Midia, mana sua fav foi falsa a beça criou fic a beça e é culpa da globo kkkkkkkk
315,Midia, a maior fanfiqueira que passou pelo bbb kkkkkkkkk
316,Midia, começou as fanfic 
317,Midia,nesse bbb eu gosto do jogo do arthur e gustavo pq eles observam e veem o jogo com clareza sabem se posicionar o resto ou é insuportável ou ta a passeio ou cria fanfic gosto de outros participantes mas o jogo deles lá dentro deixa a desejar espero ver mais deles 
318,Midia,mas a verdade também é o brasil perdeu o casal com mais química física biologia matemática e toda a grade do enem possível da história do bbb a fanfic chora sofre estamos desolados 
319,Midia,novamente dizendo que sabor em saber que não é fic boa noite família vou rever os mimos de hj e partiu berço lais e pedro sumiram o bbb eles assistem amanhã que hj tão ocupados 
320,Midia,o bbb desse ano tá tão ruim que eu amo ver os vídeos de fic do tiktok kkkkkkkkkkkkkkkkkkkk ×melhor
321,Midia, deve ser uma fanfic bem mal feita no começo do bbb eles tavam de boa pô até ela ser líder
322,Midia,a piveta é eliminada o cero na humildade vai lá pedir desculpa por algo sendo que ela criou uma fanfic de rivalidade na cabeça dela ai ela vira a cara nem fala com o pivete direito era pra arthur largar vá lá sua inhaçá me escolheu se fu 
323,Midia, simmm esse bbb já tá flopado mesmo o arthur se achando d tbm seria uma boa pra movimentar as fic deles
324,Midia,o pessoal no bbb achando que é paredão falso e criando toda uma fic kkkkkkkk
325,Midia,totalmente verdadeira e indo ate o fim com a fanfic que ela criou na cabeça dela 
326,Midia, a globo sempre puxa o saco dela na edição é cansativo quem se guiou pelo programa de hj vai ficar achando que o arthur comprou essa briga desde o começo quando na vdd foi só uma fanfic da jade
327,Midia,unica coisa que salvava o bbb era a fic que a jade criou de rivalidade com o arthur agora quero ver o que vai salver essa flop 
328,Midia,mamãe q só assistia o bbb por causa da jade e do pa está arrasada ela ficava o dia vendo vídeo deles dois acompanhando a fic
329,Midia,que que a laís falou agora qual fanfic ela tá inventando dessa vez 
330,Midia,os gays regina george dizendo que vão deixar de ver o bbb a fic de centavos kkkk
331,Midia,graças a fanfiqueira da larissa que o povo colocou lá dentro eslô e vyni não vão ser votados nem tão cedo e vão parar na final esse bbb tá páreo duro com o 
332,Midia, o público não quis te dar uma segunda chance no aaaaaaaaaah fic que eu pedi
333,Midia, eu sei que você é fanfiqueiro
334,Midia, se a jessi é planta sendo pauta toda semana e sendo uma das que mais tretou até o momento então imagina a jadoca e metade daquele cast imagina alguém citar essa fic em pleno março
335,Midia,meu deus eu to fanficando mt o bbb entre o meu terceirao quero fazer com q venha aí
336,Midia, aff queria aumentar a fic hahahah mas eu n tinha visto mesmo
337,Midia,gustavo voltando a se arrastar pela laís é mais uma prova de que o roteiro desse bbb foi escrito por um autor intelectual e não por uma autora de fic do orkut isso é uma crítica pesada entendam 
338,Midia,me apaixonei pela jade nas primeiras semanas do bbb e desadotei ela depois que ela deu de fanfiqueira mas a gata é estilosa e continuarei acompanhando pq na moda ela é a top mesmo porém no bbb nao deu pra ela e espero que enquanto ela envelhece consiga mudar um pouco 
339,Midia, eu queria tanto que a continuação do pós bbb fosse igual está na sua fic eu ia amar se tudo isso fosse nossa você vai fazendo meus sentimentos sariettes ficar a flor da pele 
340,Midia,a globo expondo a fanfic do eli e do vyni
341,Midia,nao acredito que o vai ganhar esse bbb só pq a corna inventou aquela fic do pão no começo ainda bem que larguei mão desse fracasso de programa la no início
342,Midia,a minha fic é que a jade e o arthur tinham um caso aqui fora terminaram de um jeito que ela não gostou por causa da maira e ela trouxe toda essa raiva de volta no bbb e o arthur se faz de maluco pra isso n vazar nem dar nenhum sinal
